{
  "schema": 1,
  "candidateHash": "b304b951e246a37e9261ceb515d4b53697f74f911131c544348435ac487cd2ee",
  "sourceSnapshotHash": "a78e8615e519ed24c9af58482159230f49c558be89104d8d511f3c7939ec5eb0",
  "sourceManifestHash": "54e6fa2e6fcb3aadcd9e9b081a2004eff34ad238d355f56335d9ffb2ddee8f5e",
  "rulesVersion": "reviewed-content-v1",
  "writerId": "codex-writer-p1-p3-20261031",
  "reviewerId": "codex-independent-reviewer:/root/implementation_content_review",
  "reviewId": "p1-p3-content-20261031-d0052e7a-1514-4577-983a-91e0e9ff7354",
  "verdict": "APPROVE",
  "privacy": "PASS",
  "rights": "PASS",
  "stages": {
    "WS20261031-001": {
      "dictionary": "PASS",
      "memory": "PASS",
      "semanticConnection": "PASS",
      "syntax": "PASS",
      "concept": "PASS",
      "contrast": "PASS",
      "languageGame": "PASS",
      "englishNeighbors": "PASS",
      "pragmaticAction": "PASS",
      "workplaceUse": "PASS"
    },
    "V20261029-005": {
      "dictionary": "PASS",
      "memory": "PASS",
      "semanticConnection": "PASS",
      "syntax": "PASS",
      "concept": "PASS",
      "contrast": "PASS",
      "languageGame": "PASS",
      "englishNeighbors": "PASS",
      "pragmaticAction": "PASS",
      "workplaceUse": "PASS"
    },
    "V20261029-006": {
      "dictionary": "PASS",
      "memory": "PASS",
      "semanticConnection": "PASS",
      "syntax": "PASS",
      "concept": "PASS",
      "contrast": "PASS",
      "languageGame": "PASS",
      "englishNeighbors": "PASS",
      "pragmaticAction": "PASS",
      "workplaceUse": "PASS"
    },
    "WS20261031-004": {
      "dictionary": "PASS",
      "memory": "PASS",
      "semanticConnection": "PASS",
      "syntax": "PASS",
      "concept": "PASS",
      "contrast": "PASS",
      "languageGame": "PASS",
      "englishNeighbors": "PASS",
      "pragmaticAction": "PASS",
      "workplaceUse": "PASS"
    },
    "WS20261031-006": {
      "dictionary": "PASS",
      "memory": "PASS",
      "semanticConnection": "PASS",
      "syntax": "PASS",
      "concept": "PASS",
      "contrast": "PASS",
      "languageGame": "PASS",
      "englishNeighbors": "PASS",
      "pragmaticAction": "PASS",
      "workplaceUse": "PASS"
    }
  }
}
